Starting update...
ERROR: It looks like the server may be running (ports in use):
80
Stop the server and re-run, or use --force to override (not recommended).
Update finished with exit code: 1
Starting update...
Warning: server ports in use, continuing because --force was supplied: [80]
Extracting ZIP to temporary dir: C:\Users\steve\AppData\Local\Temp\obs_update_vvkpg406
Using release directory: C:\Users\steve\AppData\Local\Temp\obs_update_vvkpg406\Obsidianscout-main
Backup root: C:\Users\steve\obsidianscouttestversion\backups\update_backup_20251224_173019
Backing up existing 'C:\Users\steve\obsidianscouttestversion\.gitattributes' -> 'C:\Users\steve\obsidianscouttestversion\backups\update_backup_20251224_173019\.gitattributes'
Replacing 'C:\Users\steve\obsidianscouttestversion\.gitattributes' with 'C:\Users\steve\AppData\Local\Temp\obs_update_vvkpg406\Obsidianscout-main\.gitattributes'
Replacing 'C:\Users\steve\obsidianscouttestversion\.vscode' with 'C:\Users\steve\AppData\Local\Temp\obs_update_vvkpg406\Obsidianscout-main\.vscode'
Replacing 'C:\Users\steve\obsidianscouttestversion\ALLIANCE_FIXES_SUMMARY.md' with 'C:\Users\steve\AppData\Local\Temp\obs_update_vvkpg406\Obsidianscout-main\ALLIANCE_FIXES_SUMMARY.md'
Backing up existing 'C:\Users\steve\obsidianscouttestversion\app' -> 'C:\Users\steve\obsidianscouttestversion\backups\update_backup_20251224_173019\app'
Replacing 'C:\Users\steve\obsidianscouttestversion\app' with 'C:\Users\steve\AppData\Local\Temp\obs_update_vvkpg406\Obsidianscout-main\app'
Backing up existing 'C:\Users\steve\obsidianscouttestversion\assets' -> 'C:\Users\steve\obsidianscouttestversion\backups\update_backup_20251224_173019\assets'
Replacing 'C:\Users\steve\obsidianscouttestversion\assets' with 'C:\Users\steve\AppData\Local\Temp\obs_update_vvkpg406\Obsidianscout-main\assets'
Replacing 'C:\Users\steve\obsidianscouttestversion\assistant_responses.json' with 'C:\Users\steve\AppData\Local\Temp\obs_update_vvkpg406\Obsidianscout-main\assistant_responses.json'
Replacing 'C:\Users\steve\obsidianscouttestversion\check_pit_data.py' with 'C:\Users\steve\AppData\Local\Temp\obs_update_vvkpg406\Obsidianscout-main\check_pit_data.py'
Replacing 'C:\Users\steve\obsidianscouttestversion\cleanup' with 'C:\Users\steve\AppData\Local\Temp\obs_update_vvkpg406\Obsidianscout-main\cleanup'
[Preserved Add] Adding new directory: 'config\defaults'
Replacing 'C:\Users\steve\obsidianscouttestversion\docs' with 'C:\Users\steve\AppData\Local\Temp\obs_update_vvkpg406\Obsidianscout-main\docs'
Replacing 'C:\Users\steve\obsidianscouttestversion\examples' with 'C:\Users\steve\AppData\Local\Temp\obs_update_vvkpg406\Obsidianscout-main\examples'
Replacing 'C:\Users\steve\obsidianscouttestversion\fix.txt' with 'C:\Users\steve\AppData\Local\Temp\obs_update_vvkpg406\Obsidianscout-main\fix.txt'
Replacing 'C:\Users\steve\obsidianscouttestversion\flake_report.txt' with 'C:\Users\steve\AppData\Local\Temp\obs_update_vvkpg406\Obsidianscout-main\flake_report.txt'
Backing up existing 'C:\Users\steve\obsidianscouttestversion\help' -> 'C:\Users\steve\obsidianscouttestversion\backups\update_backup_20251224_173019\help'
Replacing 'C:\Users\steve\obsidianscouttestversion\help' with 'C:\Users\steve\AppData\Local\Temp\obs_update_vvkpg406\Obsidianscout-main\help'
[Preserved Add] Adding new file: 'instance\apis.db'
[Preserved Add] Adding new file: 'instance\apis.db-shm'
[Preserved Add] Adding new file: 'instance\apis.db-wal'
[Preserved Add] Adding new directory: 'instance\backup'
[Preserved Add] Adding new directory: 'instance\chat\groups'
[Preserved Add] Adding new directory: 'instance\chat\users'
[Preserved Add] Adding new file: 'instance\configs\0\game_config.json.bak'
[Preserved Add] Adding new directory: 'instance\configs\1'
[Preserved Add] Adding new directory: 'instance\configs\100'
[Preserved Add] Adding new directory: 'instance\configs\10661'
[Preserved Add] Adding new directory: 'instance\configs\1111'
[Preserved Add] Adding new directory: 'instance\configs\200'
[Preserved Add] Adding new directory: 'instance\configs\2222'
[Preserved Add] Adding new directory: 'instance\configs\23'
[Preserved Add] Adding new file: 'instance\configs\5454\theme_config.json'
[Preserved Add] Adding new directory: 'instance\configs\9988'
[Preserved Add] Adding new directory: 'instance\configs\9999'
[Preserved Add] Adding new file: 'instance\config_save_debug.log'
[Preserved Add] Adding new file: 'instance\embeddings.db'
[Preserved Add] Adding new file: 'instance\instance.db'
[Preserved Add] Adding new file: 'instance\misc.db'
[Preserved Add] Adding new file: 'instance\misc.db-shm'
[Preserved Add] Adding new file: 'instance\misc.db-wal'
[Preserved Add] Adding new file: 'instance\pages.db'
[Preserved Add] Adding new file: 'instance\pages.db-shm'
[Preserved Add] Adding new file: 'instance\pages.db-wal'
[Preserved Add] Adding new file: 'instance\strategy_shares.json'
[Preserved Add] Adding new directory: 'instance\uploads\pit_scouting'
[Preserved Add] Adding new file: 'instance\users.db-shm'
[Preserved Add] Adding new file: 'instance\users.db-wal'
[Preserved Add] Adding new file: 'instance\users.db.bak'
[Preserved Add] Adding new file: 'instance\user_prefs.json'
[Preserved Add] Adding new file: 'migrations\versions\9f3b4c6d7e8f_add_custom_page_table.py'
[Preserved Add] Adding new file: 'migrations\versions\add_added_by_to_scouting_alliance_event.py'
[Preserved Add] Adding new file: 'migrations\versions\add_data_sharing_active_to_alliance_member.py'
[Preserved Add] Adding new file: 'migrations\versions\e4b7c9a2d1f6_add_only_password_reset_emails.py'
[Preserved Add] Adding new file: 'migrations\versions\merge_heads_resolve_20250918.py'
Backing up existing 'C:\Users\steve\obsidianscouttestversion\other' -> 'C:\Users\steve\obsidianscouttestversion\backups\update_backup_20251224_173019\other'
Replacing 'C:\Users\steve\obsidianscouttestversion\other' with 'C:\Users\steve\AppData\Local\Temp\obs_update_vvkpg406\Obsidianscout-main\other'
Replacing 'C:\Users\steve\obsidianscouttestversion\plugins' with 'C:\Users\steve\AppData\Local\Temp\obs_update_vvkpg406\Obsidianscout-main\plugins'
Replacing 'C:\Users\steve\obsidianscouttestversion\prepare_for_publish.py' with 'C:\Users\steve\AppData\Local\Temp\obs_update_vvkpg406\Obsidianscout-main\prepare_for_publish.py'
Backing up existing 'C:\Users\steve\obsidianscouttestversion\README.md' -> 'C:\Users\steve\obsidianscouttestversion\backups\update_backup_20251224_173019\README.md'
Replacing 'C:\Users\steve\obsidianscouttestversion\README.md' with 'C:\Users\steve\AppData\Local\Temp\obs_update_vvkpg406\Obsidianscout-main\README.md'
Backing up existing 'C:\Users\steve\obsidianscouttestversion\requirements.txt' -> 'C:\Users\steve\obsidianscouttestversion\backups\update_backup_20251224_173019\requirements.txt'
Replacing 'C:\Users\steve\obsidianscouttestversion\requirements.txt' with 'C:\Users\steve\AppData\Local\Temp\obs_update_vvkpg406\Obsidianscout-main\requirements.txt'
Backing up existing 'C:\Users\steve\obsidianscouttestversion\run.py' -> 'C:\Users\steve\obsidianscouttestversion\backups\update_backup_20251224_173019\run.py'
Replacing 'C:\Users\steve\obsidianscouttestversion\run.py' with 'C:\Users\steve\AppData\Local\Temp\obs_update_vvkpg406\Obsidianscout-main\run.py'
Backing up existing 'C:\Users\steve\obsidianscouttestversion\scripts' -> 'C:\Users\steve\obsidianscouttestversion\backups\update_backup_20251224_173019\scripts'
Replacing 'C:\Users\steve\obsidianscouttestversion\scripts' with 'C:\Users\steve\AppData\Local\Temp\obs_update_vvkpg406\Obsidianscout-main\scripts'
[Preserved Add] Adding new directory: 'ssl'
Replacing 'C:\Users\steve\obsidianscouttestversion\START.bat' with 'C:\Users\steve\AppData\Local\Temp\obs_update_vvkpg406\Obsidianscout-main\START.bat'
Replacing 'C:\Users\steve\obsidianscouttestversion\START.ps1' with 'C:\Users\steve\AppData\Local\Temp\obs_update_vvkpg406\Obsidianscout-main\START.ps1'
Replacing 'C:\Users\steve\obsidianscouttestversion\sw.js' with 'C:\Users\steve\AppData\Local\Temp\obs_update_vvkpg406\Obsidianscout-main\sw.js'
Backing up existing 'C:\Users\steve\obsidianscouttestversion\tests' -> 'C:\Users\steve\obsidianscouttestversion\backups\update_backup_20251224_173019\tests'
Replacing 'C:\Users\steve\obsidianscouttestversion\tests' with 'C:\Users\steve\AppData\Local\Temp\obs_update_vvkpg406\Obsidianscout-main\tests'
Replacing 'C:\Users\steve\obsidianscouttestversion\test_filtering.py' with 'C:\Users\steve\AppData\Local\Temp\obs_update_vvkpg406\Obsidianscout-main\test_filtering.py'
Replacing 'C:\Users\steve\obsidianscouttestversion\tools' with 'C:\Users\steve\AppData\Local\Temp\obs_update_vvkpg406\Obsidianscout-main\tools'
Backing up existing 'C:\Users\steve\obsidianscouttestversion\update_from_github_file.py' -> 'C:\Users\steve\obsidianscouttestversion\backups\update_backup_20251224_173019\update_from_github_file.py'
Replacing 'C:\Users\steve\obsidianscouttestversion\update_from_github_file.py' with 'C:\Users\steve\AppData\Local\Temp\obs_update_vvkpg406\Obsidianscout-main\update_from_github_file.py'
Replacing 'C:\Users\steve\obsidianscouttestversion\vendor_inventory.json' with 'C:\Users\steve\AppData\Local\Temp\obs_update_vvkpg406\Obsidianscout-main\vendor_inventory.json'
Replacing 'C:\Users\steve\obsidianscouttestversion\verify_route_isolation.py' with 'C:\Users\steve\AppData\Local\Temp\obs_update_vvkpg406\Obsidianscout-main\verify_route_isolation.py'
Backing up existing 'C:\Users\steve\obsidianscouttestversion\__pycache__' -> 'C:\Users\steve\obsidianscouttestversion\backups\update_backup_20251224_173019\__pycache__'
Replacing 'C:\Users\steve\obsidianscouttestversion\__pycache__' with 'C:\Users\steve\AppData\Local\Temp\obs_update_vvkpg406\Obsidianscout-main\__pycache__'

Update summary:
  Changed/Replaced: 30 items
    - .gitattributes
    - .vscode
    - ALLIANCE_FIXES_SUMMARY.md
    - app
    - assets
    - assistant_responses.json
    - check_pit_data.py
    - cleanup
    - docs
    - examples
    - fix.txt
    - flake_report.txt
    - help
    - other
    - plugins
    - prepare_for_publish.py
    - README.md
    - requirements.txt
    - run.py
    - scripts
    - START.bat
    - START.ps1
    - sw.js
    - tests
    - test_filtering.py
    - tools
    - update_from_github_file.py
    - vendor_inventory.json
    - verify_route_isolation.py
    - __pycache__
  Skipped/Preserved: 6 items
    - .github (VCS - skipped)
    - app_config.json (preserved (merged 5 new key(s)))
    - config (preserved (merged 4 new items))
    - instance (preserved (merged 140 new items))
    - migrations (preserved (merged 5 new items))
    - ssl (preserved (merged 2 new items))

Update applied. A backup of replaced files is in:
  C:\Users\steve\obsidianscouttestversion\backups\update_backup_20251224_173019

Next steps:
  - Review the backup folder before deleting it.
  - If the update included dependency changes, run: pip install -r requirements.txt
  - Run database migrations if needed (check project docs).
Update finished with exit code: 0